{
  "$schema": "https://ui.bejamas.com/schema.json",
  "style": "bejamas-juno",
  "tailwind": {
    "config": "",
    "css": "src/styles/globals.css",
    "baseColor": "neutral",
    "cssVariables": true
  },
  "iconLibrary": "lucide",
  "aliases": {
    "components": "@repo/ui/components",
    "utils": "@repo/ui/lib/utils",
    "hooks": "@repo/ui/hooks",
    "lib": "@repo/ui/lib",
    "ui": "@repo/ui/components"
  },
  "registries": {
    "@shadcnblocks": "https://ui.bejamas.com/r/shadcnblocks/styles/{style}/{name}.json"
  }
}
