{
  "$schema": "https://ui.bejamas.com/schema.json",
  "style": "bejamas-juno",
  "tailwind": {
    "config": "",
    "css": "../../packages/ui/src/styles/globals.css",
    "baseColor": "neutral",
    "cssVariables": true
  },
  "iconLibrary": "lucide",
  "aliases": {
    "components": "@/components",
    "hooks": "@/hooks",
    "lib": "@/lib",
    "utils": "@repo/ui/lib/utils",
    "ui": "@repo/ui/components"
  },
  "registries": {
    "@shadcnblocks": "https://www.shadcnblocks.com/r/{style}/{name}"
  }
}
